{
  "schema_version": "query-fixture-manifest-v1",
  "status": "contract-only",
  "minimum_query_count": 300,
  "recommended_split": {
    "development": 0.6,
    "validation": 0.2,
    "test": 0.2
  },
  "split_tolerance": 0.05,
  "required_query_types": [
    "semantic",
    "exact_identifier",
    "typo",
    "morphology",
    "long_context",
    "negative"
  ],
  "minimum_queries_per_type": 30,
  "required_document_size_buckets": ["small", "medium", "large"],
  "required_filter_selectivity_buckets": ["low", "medium", "high"],
  "corpus_checksum": "sha256:80170ea3cd3b1adb2b4ecc71918a9460a87050a6cfbcf22fa639611e8dded919",
  "parser_version": "mixed",
  "parser_versions": [
    "csv-v1",
    "email-v1",
    "html-v3",
    "json-v1",
    "jsonl-v1",
    "plain-text-v1",
    "rtf-v1",
    "xml-v1",
    "yaml-v1"
  ],
  "chunking_version": "paragraph-pack-v2",
  "embedding_manifest_id": null,
  "privacy_classification": "private-local",
  "notes": "Synthetic representative corpus candidate fixture; labels require review before final acceptance."
}
